780999002009,7,7809990020097,Luces,XINGXHENG,SQUARE Multipurpose ,3,Color,Blanco,$600,$504,1664,150,123,45,92,,,No registra,$462,1,No incluye baterias,"<div style=""padding:18px 22px; max-width:900px; margin:auto;""> <p style=""margin-bottom:14px;""> La luz XINGXHENG SQUARE Multipurpose es una opción práctica para sumar visibilidad a tu bicicleta en el uso diario. Ideal para quienes buscan complementar su equipamiento con una alternativa simple y funcional. </p> <p style=""margin-bottom:20px;""> Una buena opción para renovar una luz o añadir un punto de iluminación adicional, manteniendo una configuración fácil de integrar según tu rutina de pedaleo. </p> <!-- <p style=""margin-bottom:20px;""> [Párrafo 3 opcional] </p> --> <hr style=""margin:25px 0;""> <h3 style=""margin-bottom:12px;"">Especificaciones Técnicas</h3> <table style=""width:100%; border-collapse:collapse;""> <tr> <td style=""padding:8px; border-bottom:1px solid #ddd;""><b>Tipo de producto</b></td> <td style=""padding:8px; border-bottom:1px solid #ddd;"">Luces</td> </tr> <tr> <td style=""padding:8px; border-bottom:1px solid #ddd;""><b>Marca</b></td> <td style=""padding:8px; border-bottom:1px solid #ddd;"">XINGXHENG</td> </tr> <tr> <td style=""padding:8px; border-bottom:1px solid #ddd;""><b>Modelo</b></td> <td style=""padding:8px; border-bottom:1px solid #ddd;"">SQUARE Multipurpose</td> </tr> <tr> <td style=""padding:8px; border-bottom:1px solid #ddd;""><b>Variante</b></td> <td style=""padding:8px; border-bottom:1px solid #ddd;"">Color: Blanco</td> </tr> <tr> <td style=""padding:8px; border-bottom:1px solid #ddd;""><b>Peso completo</b></td> <td style=""padding:8px; border-bottom:1px solid #ddd;"">92 g</td> </tr> <tr> <td style=""padding:8px; border-bottom:1px solid #ddd;""><b>Dimensiones de envío</b></td> <td style=""padding:8px; border-bottom:1px solid #ddd;"">150 x 123 x 45</td> </tr> <tr> <td style=""padding:8px; border-bottom:1px solid #ddd;""><b>Observaciones</b></td> <td style=""padding:8px; border-bottom:1px solid #ddd;"">No incluye baterias</td> </tr> </table> </div>","Luz para bicicleta XINGXHENG SQUARE Multipurpose, pensada para mejorar la visibilidad y acompañar tus trayectos diarios o salidas recreativas.",LUC-XIN-SQU-B,Luces XINGXHENG SQUARE Multipurpose ,Luces XINGXHENG SQUARE Multipurpose  Blanco ,Accesorios,Iluminación,830250,https://clubike.cl/imagenes/LUC-XIN-SQU-B.jpg,Accesorios / Iluminación,1,1,"Visibilidad, Nocturno",Clubike,TRUE
780999002010,3,7809990020103,Luces,Radical Mountain,Seguridad,1,Color,Rojo,"$3,500","$2,941",L940,145,103,50,57,,,MKR,"$2,368",1,No incluye pilas AAA ,"<div style=""padding:18px 22px; max-width:900px; margin:auto;""> <p style=""margin-bottom:14px;""> La luz Radical Mountain Seguridad es una opción práctica para sumar visibilidad a tu bicicleta en el uso diario. Ideal para complementar tu equipamiento y moverte con más confianza en distintos entornos. </p> <p style=""margin-bottom:20px;""> Una alternativa simple para renovar una luz o añadir un punto de iluminación adicional, manteniendo una configuración fácil de integrar según tu rutina de pedaleo. </p> <!-- <p style=""margin-bottom:20px;""> [Párrafo 3 opcional] </p> --> <hr style=""margin:25px 0;""> <h3 style=""margin-bottom:12px;"">Especificaciones Técnicas</h3> <table style=""width:100%; border-collapse:collapse;""> <tr> <td style=""padding:8px; border-bottom:1px solid #ddd;""><b>Tipo de producto</b></td> <td style=""padding:8px; border-bottom:1px solid #ddd;"">Luces</td> </tr> <tr> <td style=""padding:8px; border-bottom:1px solid #ddd;""><b>Marca</b></td> <td style=""padding:8px; border-bottom:1px solid #ddd;"">Radical Mountain</td> </tr> <tr> <td style=""padding:8px; border-bottom:1px solid #ddd;""><b>Modelo</b></td> <td style=""padding:8px; border-bottom:1px solid #ddd;"">Seguridad</td> </tr> <tr> <td style=""padding:8px; border-bottom:1px solid #ddd;""><b>Variante</b></td> <td style=""padding:8px; border-bottom:1px solid #ddd;"">Color: Rojo</td> </tr> <tr> <td style=""padding:8px; border-bottom:1px solid #ddd;""><b>Peso completo</b></td> <td style=""padding:8px; border-bottom:1px solid #ddd;"">57 g</td> </tr> <tr> <td style=""padding:8px; border-bottom:1px solid #ddd;""><b>Dimensiones de envío</b></td> <td style=""padding:8px; border-bottom:1px solid #ddd;"">145 x 103 x 50</td> </tr> <tr> <td style=""padding:8px; border-bottom:1px solid #ddd;""><b>Observaciones</b></td> <td style=""padding:8px; border-bottom:1px solid #ddd;"">No incluye pilas AAA</td> </tr> </table> </div>","Luz para bicicleta Radical Mountain Seguridad, pensada para mejorar la visibilidad en trayectos diarios y salidas recreativas.",LUC-RAD-SEG-R,Luces Radical Mountain Seguridad,Luces Radical Mountain Seguridad Rojo ,Accesorios,Iluminación,746750,https://clubike.cl/imagenes/LUC-RAD-SEG-R.jpg,Accesorios / Iluminación,1,1,"Visibilidad, Nocturno",Clubike,TRUE
780999002011,0,7809990020110,Luces,Besatti,Ultra brillo,1,Color,Rojo,"$5,300","$4,454",60139,146,98,45,68,,,No registra,"$4,077",1,No incluye pilas AAA (x2) ,"<div style=""padding:18px 22px; max-width:900px; margin:auto;""> <p style=""margin-bottom:14px;""> La luz Besatti Ultra brillo es una alternativa práctica para sumar visibilidad a la bicicleta en el uso diario. Ideal para complementar tu equipamiento y moverte con más confianza en distintos entornos. </p> <p style=""margin-bottom:20px;""> Una opción simple para renovar una luz desgastada o añadir un punto de iluminación adicional, manteniendo una configuración fácil de integrar según tu rutina de pedaleo. </p> <!-- <p style=""margin-bottom:20px;""> [Párrafo 3 opcional] </p> --> <hr style=""margin:25px 0;""> <h3 style=""margin-bottom:12px;"">Especificaciones Técnicas</h3> <table style=""width:100%; border-collapse:collapse;""> <tr> <td style=""padding:8px; border-bottom:1px solid #ddd;""><b>Tipo de producto</b></td> <td style=""padding:8px; border-bottom:1px solid #ddd;"">Luces</td> </tr> <tr> <td style=""padding:8px; border-bottom:1px solid #ddd;""><b>Marca</b></td> <td style=""padding:8px; border-bottom:1px solid #ddd;"">Besatti</td> </tr> <tr> <td style=""padding:8px; border-bottom:1px solid #ddd;""><b>Modelo</b></td> <td style=""padding:8px; border-bottom:1px solid #ddd;"">Ultra brillo</td> </tr> <tr> <td style=""padding:8px; border-bottom:1px solid #ddd;""><b>Variante</b></td> <td style=""padding:8px; border-bottom:1px solid #ddd;"">Color: Rojo</td> </tr> <tr> <td style=""padding:8px; border-bottom:1px solid #ddd;""><b>Peso completo</b></td> <td style=""padding:8px; border-bottom:1px solid #ddd;"">68 g</td> </tr> <tr> <td style=""padding:8px; border-bottom:1px solid #ddd;""><b>Dimensiones de envío</b></td> <td style=""padding:8px; border-bottom:1px solid #ddd;"">146 x 98 x 45</td> </tr> <tr> <td style=""padding:8px; border-bottom:1px solid #ddd;""><b>Observaciones</b></td> <td style=""padding:8px; border-bottom:1px solid #ddd;"">No incluye pilas AAA (x2)</td> </tr> </table> </div>","Luz para bicicleta Besatti Ultra brillo, pensada para mejorar la visibilidad en trayectos diarios y salidas recreativas.",LUC-BES-ULT-R,Luces Besatti Ultra brillo,Luces Besatti Ultra brillo Rojo ,Accesorios,Iluminación,643860,https://clubike.cl/imagenes/LUC-BES-ULT-R.jpg,Accesorios / Iluminación,1,1,"Visibilidad, Nocturno",Clubike,TRUE
780999002012,7,7809990020127,Luces,Generico,Bicolor,1,Color,"Blanco,rojo,azul","$4,500","$3,782",410-147,176,76,35,66,15,,No registra,"$3,462",1,"Battery auto save, new flashing model","<div style=""padding:18px 22px; max-width:900px; margin:auto;""> <p style=""margin-bottom:14px;""> La luz Generico Bicolor es una opción práctica para sumar visibilidad a tu bicicleta en el uso diario. Ideal para complementar tu equipamiento y moverte con más confianza en distintos entornos. </p> <p style=""margin-bottom:20px;""> Una alternativa simple para renovar una luz o añadir un punto de iluminación adicional, manteniendo una configuración versátil para tu rutina de pedaleo. </p> <!-- <p style=""margin-bottom:20px;""> [Párrafo 3 opcional] </p> --> <hr style=""margin:25px 0;""> <h3 style=""margin-bottom:12px;"">Especificaciones Técnicas</h3> <table style=""width:100%; border-collapse:collapse;""> <tr> <td style=""padding:8px; border-bottom:1px solid #ddd;""><b>Tipo de producto</b></td> <td style=""padding:8px; border-bottom:1px solid #ddd;"">Luces</td> </tr> <tr> <td style=""padding:8px; border-bottom:1px solid #ddd;""><b>Marca</b></td> <td style=""padding:8px; border-bottom:1px solid #ddd;"">Generico</td> </tr> <tr> <td style=""padding:8px; border-bottom:1px solid #ddd;""><b>Modelo</b></td> <td style=""padding:8px; border-bottom:1px solid #ddd;"">Bicolor</td> </tr> <tr> <td style=""padding:8px; border-bottom:1px solid #ddd;""><b>Variante</b></td> <td style=""padding:8px; border-bottom:1px solid #ddd;"">Color: Blanco, rojo, azul</td> </tr> <tr> <td style=""padding:8px; border-bottom:1px solid #ddd;""><b>Flujo luminoso</b></td> <td style=""padding:8px; border-bottom:1px solid #ddd;"">15 LM</td> </tr> <tr> <td style=""padding:8px; border-bottom:1px solid #ddd;""><b>Peso completo</b></td> <td style=""padding:8px; border-bottom:1px solid #ddd;"">66 g</td> </tr> <tr> <td style=""padding:8px; border-bottom:1px solid #ddd;""><b>Dimensiones de envío</b></td> <td style=""padding:8px; border-bottom:1px solid #ddd;"">176 x 76 x 35</td> </tr> <tr> <td style=""padding:8px; border-bottom:1px solid #ddd;""><b>Observaciones</b></td> <td style=""padding:8px; border-bottom:1px solid #ddd;"">Battery auto save, new flashing model</td> </tr> </table> </div>","Luz para bicicleta Generico Bicolor, pensada para mejorar la visibilidad en trayectos diarios y salidas recreativas.",LUC-GEN-BIC-B,Luces Generico Bicolor,"Luces Generico Bicolor Blanco,rojo,azul 15 LM",Accesorios,Iluminación,468160,https://clubike.cl/imagenes/LUC-GEN-BIC-B.jpg,Accesorios / Iluminación,1,1,"Visibilidad, Nocturno",Clubike,TRUE
780999002013,4,7809990020134,Luces,Generico,Con bocina,1,Color,Blanco,"$7,400","$6,218",40185,107,51,72,123,250,,No registra,"$5,692",1,"Bocina(speaker) 140 db, cuenta con una interface para cargar micro usb, incluye cable usb y banda para sujetar. ","<div style=""padding:18px 22px; max-width:900px; margin:auto;""> <p style=""margin-bottom:14px;""> La luz Generico Con bocina es una opción práctica para sumar visibilidad a tu bicicleta en el uso diario. Ideal para complementar tu equipamiento y moverte con mayor confianza en distintos entornos. </p> <p style=""margin-bottom:20px;""> Una alternativa simple para renovar una luz o añadir un punto de iluminación adicional, con un uso pensado para adaptarse a tu rutina de pedaleo. </p> <!-- <p style=""margin-bottom:20px;""> [Párrafo 3 opcional] </p> --> <hr style=""margin:25px 0;""> <h3 style=""margin-bottom:12px;"">Especificaciones Técnicas</h3> <table style=""width:100%; border-collapse:collapse;""> <tr> <td style=""padding:8px; border-bottom:1px solid #ddd;""><b>Tipo de producto</b></td> <td style=""padding:8px; border-bottom:1px solid #ddd;"">Luces</td> </tr> <tr> <td style=""padding:8px; border-bottom:1px solid #ddd;""><b>Marca</b></td> <td style=""padding:8px; border-bottom:1px solid #ddd;"">Generico</td> </tr> <tr> <td style=""padding:8px; border-bottom:1px solid #ddd;""><b>Modelo</b></td> <td style=""padding:8px; border-bottom:1px solid #ddd;"">Con bocina</td> </tr> <tr> <td style=""padding:8px; border-bottom:1px solid #ddd;""><b>Variante</b></td> <td style=""padding:8px; border-bottom:1px solid #ddd;"">Color: Blanco</td> </tr> <tr> <td style=""padding:8px; border-bottom:1px solid #ddd;""><b>Flujo luminoso (lúmenes)</b></td> <td style=""padding:8px; border-bottom:1px solid #ddd;"">250</td> </tr> <tr> <td style=""padding:8px; border-bottom:1px solid #ddd;""><b>Peso completo</b></td> <td style=""padding:8px; border-bottom:1px solid #ddd;"">123 g</td> </tr> <tr> <td style=""padding:8px; border-bottom:1px solid #ddd;""><b>Dimensiones de envío</b></td> <td style=""padding:8px; border-bottom:1px solid #ddd;"">107 x 51 x 72</td> </tr> <tr> <td style=""padding:8px; border-bottom:1px solid #ddd;""><b>Observaciones</b></td> <td style=""padding:8px; border-bottom:1px solid #ddd;"">Bocina(speaker) 140 db, cuenta con una interface para cargar micro usb, incluye cable usb y banda para sujetar.</td> </tr> </table> </div>","Luz para bicicleta Generico Con bocina, pensada para mejorar la visibilidad y acompañar tus trayectos urbanos o recreativos.",LUC-GEN-CON-B,Luces Generico Con bocina,Luces Generico Con bocina Blanco 250 LM,Accesorios,Iluminación,392904,https://clubike.cl/imagenes/LUC-GEN-CON-B.jpg,Accesorios / Iluminación,1,1,"Visibilidad, Nocturno, Recargable USB",Clubike,TRUE
780999002014,1,7809990020141,Luces,Generico,Super Bright,4,Color,Blanco,"$9,200","$7,731",D1404-black,90,92,76,200,1500,Cuerpo de aluminio y pc,No registra,"$7,077",1,"Recargable, alcance 300metros, incluye cable usb y soporte, 3 modos de luz, zoomable, tiempo de carga de 2 horas y duracion de la carga desde 3-5 horas.","<div style=""padding:18px 22px; max-width:900px; margin:auto;""> <p style=""margin-bottom:14px;""> La luz Genérico Super Bright es una opción práctica para sumar visibilidad a tu bicicleta en el uso diario. Ideal para complementar tu equipamiento y moverte con más confianza en distintos entornos. </p> <p style=""margin-bottom:20px;""> Una alternativa simple para renovar una luz desgastada o añadir un punto de iluminación adicional, manteniendo una configuración fácil de integrar según tu rutina de pedaleo. </p> <!-- <p style=""margin-bottom:20px;""> [Párrafo 3 opcional] </p> --> <hr style=""margin:25px 0;""> <h3 style=""margin-bottom:12px;"">Especificaciones Técnicas</h3> <table style=""width:100%; border-collapse:collapse;""> <tr> <td style=""padding:8px; border-bottom:1px solid #ddd;""><b>Tipo de producto</b></td> <td style=""padding:8px; border-bottom:1px solid #ddd;"">Luces</td> </tr> <tr> <td style=""padding:8px; border-bottom:1px solid #ddd;""><b>Marca</b></td> <td style=""padding:8px; border-bottom:1px solid #ddd;"">Generico</td> </tr> <tr> <td style=""padding:8px; border-bottom:1px solid #ddd;""><b>Modelo</b></td> <td style=""padding:8px; border-bottom:1px solid #ddd;"">Super Bright</td> </tr> <tr> <td style=""padding:8px; border-bottom:1px solid #ddd;""><b>Variante</b></td> <td style=""padding:8px; border-bottom:1px solid #ddd;"">Color: Blanco</td> </tr> <tr> <td style=""padding:8px; border-bottom:1px solid #ddd;""><b>Material</b></td> <td style=""padding:8px; border-bottom:1px solid #ddd;"">Cuerpo de aluminio y pc</td> </tr> <tr> <td style=""padding:8px; border-bottom:1px solid #ddd;""><b>Flujo luminoso</b></td> <td style=""padding:8px; border-bottom:1px solid #ddd;"">1500</td> </tr> <tr> <td style=""padding:8px; border-bottom:1px solid #ddd;""><b>Peso completo</b></td> <td style=""padding:8px; border-bottom:1px solid #ddd;"">200 g</td> </tr> <tr> <td style=""padding:8px; border-bottom:1px solid #ddd;""><b>Dimensiones de envío</b></td> <td style=""padding:8px; border-bottom:1px solid #ddd;"">90 x 92 x 76</td> </tr> <tr> <td style=""padding:8px; border-bottom:1px solid #ddd;""><b>Observaciones</b></td> <td style=""padding:8px; border-bottom:1px solid #ddd;"">Recargable, alcance 300metros, incluye cable usb y soporte, 3 modos de luz, zoomable, tiempo de carga de 2 horas y duracion de la carga desde 3-5 horas.</td> </tr> </table> </div>","Luz para bicicleta Genérico Super Bright, pensada para mejorar la visibilidad en trayectos diarios y salidas recreativas.",LUC-GEN-SUP-B,Luces Generico Super Bright,Luces Generico Super Bright Blanco 1500 LM,Accesorios,Iluminación,629280,https://clubike.cl/imagenes/LUC-GEN-SUP-B.jpg,Accesorios / Iluminación,1,1,"Visibilidad, Nocturno, Recargable USB",Clubike,TRUE
780999002015,8,7809990020158,Luces,Generico,Delantera,1,Color,Azul,"$7,000","$5,882",,120,98,35,85,300,,No registra,"$5,385",1,"Luz blanca, recargable, solo cambia color de la tapa superior por lo que tiene base negra.","<div style=""padding:18px 22px; max-width:900px; margin:auto;""> <p style=""margin-bottom:14px;""> La luz Generico Delantera es una opción práctica para sumar visibilidad al frente de tu bicicleta en el uso diario. Ideal para complementar tu equipamiento y moverte con más confianza en distintos entornos. </p> <p style=""margin-bottom:20px;""> Una alternativa simple para renovar una luz desgastada o añadir un punto de iluminación adicional, manteniendo una configuración fácil de integrar según tu rutina de pedaleo. </p> <!-- <p style=""margin-bottom:20px;""> [Párrafo 3 opcional] </p> --> <hr style=""margin:25px 0;""> <h3 style=""margin-bottom:12px;"">Especificaciones Técnicas</h3> <table style=""width:100%; border-collapse:collapse;""> <tr> <td style=""padding:8px; border-bottom:1px solid #ddd;""><b>Tipo de producto</b></td> <td style=""padding:8px; border-bottom:1px solid #ddd;"">Luces</td> </tr> <tr> <td style=""padding:8px; border-bottom:1px solid #ddd;""><b>Marca</b></td> <td style=""padding:8px; border-bottom:1px solid #ddd;"">Generico</td> </tr> <tr> <td style=""padding:8px; border-bottom:1px solid #ddd;""><b>Modelo</b></td> <td style=""padding:8px; border-bottom:1px solid #ddd;"">Delantera</td> </tr> <tr> <td style=""padding:8px; border-bottom:1px solid #ddd;""><b>Variante</b></td> <td style=""padding:8px; border-bottom:1px solid #ddd;"">Color: Azul</td> </tr> <tr> <td style=""padding:8px; border-bottom:1px solid #ddd;""><b>Flujo luminoso</b></td> <td style=""padding:8px; border-bottom:1px solid #ddd;"">300 LM</td> </tr> <tr> <td style=""padding:8px; border-bottom:1px solid #ddd;""><b>Peso completo</b></td> <td style=""padding:8px; border-bottom:1px solid #ddd;"">85 g</td> </tr> <tr> <td style=""padding:8px; border-bottom:1px solid #ddd;""><b>Dimensiones de envío</b></td> <td style=""padding:8px; border-bottom:1px solid #ddd;"">120 x 98 x 35</td> </tr> <tr> <td style=""padding:8px; border-bottom:1px solid #ddd;""><b>Observaciones</b></td> <td style=""padding:8px; border-bottom:1px solid #ddd;"">Luz blanca, recargable, solo cambia color de la tapa superior por lo que tiene base negra.</td> </tr> </table> </div>","Luz para bicicleta Generico Delantera, pensada para mejorar la visibilidad en trayectos diarios y salidas recreativas.",LUC-GEN-DEL-A,Luces Generico Delantera,Luces Generico Delantera Azul 300 LM,Accesorios,Iluminación,411600,https://clubike.cl/imagenes/LUC-GEN-DEL-A.jpg,Accesorios / Iluminación,1,1,"Visibilidad, Nocturno, Recargable USB",Clubike,TRUE
780999002016,5,7809990020165,Luces,Generico,Para casco,1,Color,"Blanco,rojo","$1,990","$1,672",,80,35,50,35,,,No registra,"$1,531",1,3 modalides,"<div style=""padding:18px 22px; max-width:900px; margin:auto;""> <p style=""margin-bottom:14px;""> La luz Generico para casco es una opción práctica para quienes buscan sumar visibilidad en sus salidas en bicicleta. Ideal como complemento para el uso diario y recorridos recreativos. </p> <p style=""margin-bottom:20px;""> Una alternativa simple para añadir un punto de luz adicional y mantener una configuración ordenada, especialmente si sueles usar casco en tus trayectos. </p> <!-- <p style=""margin-bottom:20px;""> [Párrafo 3 opcional] </p> --> <hr style=""margin:25px 0;""> <h3 style=""margin-bottom:12px;"">Especificaciones Técnicas</h3> <table style=""width:100%; border-collapse:collapse;""> <tr> <td style=""padding:8px; border-bottom:1px solid #ddd;""><b>Tipo de producto</b></td> <td style=""padding:8px; border-bottom:1px solid #ddd;"">Luces</td> </tr> <tr> <td style=""padding:8px; border-bottom:1px solid #ddd;""><b>Marca</b></td> <td style=""padding:8px; border-bottom:1px solid #ddd;"">Generico</td> </tr> <tr> <td style=""padding:8px; border-bottom:1px solid #ddd;""><b>Modelo</b></td> <td style=""padding:8px; border-bottom:1px solid #ddd;"">para casco</td> </tr> <tr> <td style=""padding:8px; border-bottom:1px solid #ddd;""><b>Variante</b></td> <td style=""padding:8px; border-bottom:1px solid #ddd;"">Color: Blanco, rojo</td> </tr> <tr> <td style=""padding:8px; border-bottom:1px solid #ddd;""><b>Peso completo</b></td> <td style=""padding:8px; border-bottom:1px solid #ddd;"">35 g</td> </tr> <tr> <td style=""padding:8px; border-bottom:1px solid #ddd;""><b>Dimensiones de envío</b></td> <td style=""padding:8px; border-bottom:1px solid #ddd;"">80 x 35 x 50</td> </tr> <tr> <td style=""padding:8px; border-bottom:1px solid #ddd;""><b>Observaciones</b></td> <td style=""padding:8px; border-bottom:1px solid #ddd;"">3 modalidades</td> </tr> </table> </div>","Luz para bicicleta Generico para casco, pensada para sumar visibilidad en trayectos diarios y salidas recreativas.",LUC-GEN-PAR-B,Luces Generico Para casco,"Luces Generico Para casco Blanco,rojo ",Accesorios,Iluminación,140000,https://clubike.cl/imagenes/LUC-GEN-PAR-B.jpg,Accesorios / Iluminación,1,1,"Visibilidad, Nocturno",Clubike,TRUE
